{
  "schema_version": "worker-result/v1",
  "message_id": "msg_probe_001",
  "job_id": "job_probe_001",
  "job_step_id": "step_probe_001",
  "status": "completed",
  "output_refs": [{"artifact_id": "artifact_probe_001", "kind": "media_probe", "role": "probe_report", "sha256": "bbbbbbbbbbbbbbbbbbbbbbbbbbbbbbbbbbbbbbbbbbbbbbbbbbbbbbbbbbbbbbbb", "size_bytes": 512}],
  "checkpoint_ref": "checkpoint_probe_001"
}
